data,canal,tema,resumo,resolvido
2025-09-15,chat,Reserva de emergência,Usuário perguntou como funciona o CDB de liquidez diária para guardar dinheiro com segurança,sim
2025-09-22,chat,Controle de gastos,Usuário teve dúvida ao visualizar seus gastos do mês e recebeu orientação de organização financeira,sim
2025-10-01,chat,Tesouro Selic,Usuário pediu uma explicação simples sobre o Tesouro Selic e quando ele faz sentido,sim
2025-10-12,chat,Metas financeiras,Usuário acompanhou o progresso da reserva de emergência e ajustou o valor mensal de aporte,sim
2025-10-25,chat,Planejamento financeiro,Usuário atualizou informações de renda e objetivos para melhorar as recomendações do Arandu,sim
